[
  {
    "team_id": "algeria",
    "name": "Algeria",
    "aliases": [
      "Algeria",
      "阿尔及利亚"
    ],
    "sources": [
      "worldcup_2026_csv",
      "world_cup_predictor"
    ],
    "updated_at": "2026-05-15T00:00:00Z",
    "localized_name": {
      "zh-CN": "阿尔及利亚"
    },
    "short_name": "ALG"
  },
  {
    "team_id": "argentina",
    "name": "Argentina",
    "aliases": [
      "Argentina",
      "阿根廷"
    ],
    "sources": [
      "worldcup_2026_csv",
      "world_cup_predictor"
    ],
    "updated_at": "2026-05-15T00:00:00Z",
    "localized_name": {
      "zh-CN": "阿根廷"
    },
    "short_name": "ARG"
  },
  {
    "team_id": "australia",
    "name": "Australia",
    "aliases": [
      "Australia",
      "澳大利亚"
    ],
    "sources": [
      "worldcup_2026_csv",
      "world_cup_predictor"
    ],
    "updated_at": "2026-05-15T00:00:00Z",
    "localized_name": {
      "zh-CN": "澳大利亚"
    },
    "short_name": "AUS"
  },
  {
    "team_id": "austria",
    "name": "Austria",
    "aliases": [
      "Austria",
      "奥地利"
    ],
    "sources": [
      "worldcup_2026_csv",
      "world_cup_predictor"
    ],
    "updated_at": "2026-05-15T00:00:00Z",
    "localized_name": {
      "zh-CN": "奥地利"
    },
    "short_name": "AUT"
  },
  {
    "team_id": "belgium",
    "name": "Belgium",
    "aliases": [
      "Belgium",
      "比利时"
    ],
    "sources": [
      "worldcup_2026_csv",
      "world_cup_predictor"
    ],
    "updated_at": "2026-05-15T00:00:00Z",
    "localized_name": {
      "zh-CN": "比利时"
    },
    "short_name": "BEL"
  },
  {
    "team_id": "bosnia-and-herzegovina",
    "name": "Bosnia and Herzegovina",
    "aliases": [
      "Bosnia and Herzegovina",
      "Bosnia-Herzegovina",
      "波斯尼亚和黑塞哥维那"
    ],
    "sources": [
      "worldcup_2026_csv",
      "world_cup_predictor"
    ],
    "updated_at": "2026-05-15T00:00:00Z",
    "localized_name": {
      "zh-CN": "波斯尼亚和黑塞哥维那"
    },
    "short_name": "BIH"
  },
  {
    "team_id": "brazil",
    "name": "Brazil",
    "aliases": [
      "Brazil",
      "巴西"
    ],
    "sources": [
      "worldcup_2026_csv",
      "world_cup_predictor"
    ],
    "updated_at": "2026-05-15T00:00:00Z",
    "localized_name": {
      "zh-CN": "巴西"
    },
    "short_name": "BRA"
  },
  {
    "team_id": "cabo-verde",
    "name": "Cabo Verde",
    "aliases": [
      "Cabo Verde",
      "Cape Verde",
      "Cape Verde Islands",
      "佛得角"
    ],
    "sources": [
      "worldcup_2026_csv",
      "world_cup_predictor"
    ],
    "updated_at": "2026-05-15T00:00:00Z",
    "localized_name": {
      "zh-CN": "佛得角"
    },
    "short_name": "CPV"
  },
  {
    "team_id": "canada",
    "name": "Canada",
    "aliases": [
      "Canada",
      "加拿大"
    ],
    "sources": [
      "worldcup_2026_csv",
      "world_cup_predictor"
    ],
    "updated_at": "2026-05-15T00:00:00Z",
    "localized_name": {
      "zh-CN": "加拿大"
    },
    "short_name": "CAN"
  },
  {
    "team_id": "colombia",
    "name": "Colombia",
    "aliases": [
      "Colombia",
      "哥伦比亚"
    ],
    "sources": [
      "worldcup_2026_csv",
      "world_cup_predictor"
    ],
    "updated_at": "2026-05-15T00:00:00Z",
    "localized_name": {
      "zh-CN": "哥伦比亚"
    },
    "short_name": "COL"
  },
  {
    "team_id": "congo-dr",
    "name": "Congo DR",
    "aliases": [
      "Congo DR",
      "DR Congo",
      "Democratic Republic of the Congo",
      "刚果民主共和国"
    ],
    "sources": [
      "worldcup_2026_csv",
      "world_cup_predictor"
    ],
    "updated_at": "2026-05-15T00:00:00Z",
    "localized_name": {
      "zh-CN": "刚果民主共和国"
    },
    "short_name": "COD"
  },
  {
    "team_id": "cote-divoire",
    "name": "Cote d'Ivoire",
    "aliases": [
      "Cote d'Ivoire",
      "Ivory Coast",
      "科特迪瓦"
    ],
    "sources": [
      "worldcup_2026_csv",
      "world_cup_predictor"
    ],
    "updated_at": "2026-05-15T00:00:00Z",
    "localized_name": {
      "zh-CN": "科特迪瓦"
    },
    "short_name": "CIV"
  },
  {
    "team_id": "croatia",
    "name": "Croatia",
    "aliases": [
      "Croatia",
      "克罗地亚"
    ],
    "sources": [
      "worldcup_2026_csv",
      "world_cup_predictor"
    ],
    "updated_at": "2026-05-15T00:00:00Z",
    "localized_name": {
      "zh-CN": "克罗地亚"
    },
    "short_name": "CRO"
  },
  {
    "team_id": "curacao",
    "name": "Curacao",
    "aliases": [
      "Curacao",
      "Curaçao",
      "库拉索"
    ],
    "sources": [
      "worldcup_2026_csv",
      "world_cup_predictor"
    ],
    "updated_at": "2026-05-15T00:00:00Z",
    "localized_name": {
      "zh-CN": "库拉索"
    },
    "short_name": "CUW"
  },
  {
    "team_id": "czechia",
    "name": "Czechia",
    "aliases": [
      "Czech Republic",
      "Czechia",
      "捷克",
      "捷克共和国"
    ],
    "sources": [
      "worldcup_2026_csv",
      "world_cup_predictor"
    ],
    "updated_at": "2026-05-15T00:00:00Z",
    "localized_name": {
      "zh-CN": "捷克共和国"
    },
    "short_name": "CZE"
  },
  {
    "team_id": "ecuador",
    "name": "Ecuador",
    "aliases": [
      "Ecuador",
      "厄瓜多尔"
    ],
    "sources": [
      "worldcup_2026_csv",
      "world_cup_predictor"
    ],
    "updated_at": "2026-05-15T00:00:00Z",
    "localized_name": {
      "zh-CN": "厄瓜多尔"
    },
    "short_name": "ECU"
  },
  {
    "team_id": "egypt",
    "name": "Egypt",
    "aliases": [
      "Egypt",
      "埃及"
    ],
    "sources": [
      "worldcup_2026_csv",
      "world_cup_predictor"
    ],
    "updated_at": "2026-05-15T00:00:00Z",
    "localized_name": {
      "zh-CN": "埃及"
    },
    "short_name": "EGY"
  },
  {
    "team_id": "england",
    "name": "England",
    "aliases": [
      "England",
      "英格兰"
    ],
    "sources": [
      "worldcup_2026_csv",
      "world_cup_predictor"
    ],
    "updated_at": "2026-05-15T00:00:00Z",
    "localized_name": {
      "zh-CN": "英格兰"
    },
    "short_name": "ENG"
  },
  {
    "team_id": "france",
    "name": "France",
    "aliases": [
      "France",
      "法国"
    ],
    "sources": [
      "worldcup_2026_csv",
      "world_cup_predictor"
    ],
    "updated_at": "2026-05-15T00:00:00Z",
    "localized_name": {
      "zh-CN": "法国"
    },
    "short_name": "FRA"
  },
  {
    "team_id": "germany",
    "name": "Germany",
    "aliases": [
      "Germany",
      "德国"
    ],
    "sources": [
      "worldcup_2026_csv",
      "world_cup_predictor"
    ],
    "updated_at": "2026-05-15T00:00:00Z",
    "localized_name": {
      "zh-CN": "德国"
    },
    "short_name": "GER"
  },
  {
    "team_id": "ghana",
    "name": "Ghana",
    "aliases": [
      "Ghana",
      "加纳"
    ],
    "sources": [
      "worldcup_2026_csv",
      "world_cup_predictor"
    ],
    "updated_at": "2026-05-15T00:00:00Z",
    "localized_name": {
      "zh-CN": "加纳"
    },
    "short_name": "GHA"
  },
  {
    "team_id": "haiti",
    "name": "Haiti",
    "aliases": [
      "Haiti",
      "海地"
    ],
    "sources": [
      "worldcup_2026_csv",
      "world_cup_predictor"
    ],
    "updated_at": "2026-05-15T00:00:00Z",
    "localized_name": {
      "zh-CN": "海地"
    },
    "short_name": "HAI"
  },
  {
    "team_id": "ir-iran",
    "name": "IR Iran",
    "aliases": [
      "IR Iran",
      "Iran",
      "伊朗"
    ],
    "sources": [
      "worldcup_2026_csv",
      "world_cup_predictor"
    ],
    "updated_at": "2026-05-15T00:00:00Z",
    "localized_name": {
      "zh-CN": "伊朗"
    },
    "short_name": "IRN"
  },
  {
    "team_id": "iraq",
    "name": "Iraq",
    "aliases": [
      "Iraq",
      "伊拉克"
    ],
    "sources": [
      "worldcup_2026_csv",
      "world_cup_predictor"
    ],
    "updated_at": "2026-05-15T00:00:00Z",
    "localized_name": {
      "zh-CN": "伊拉克"
    },
    "short_name": "IRQ"
  },
  {
    "team_id": "japan",
    "name": "Japan",
    "aliases": [
      "Japan",
      "日本"
    ],
    "sources": [
      "worldcup_2026_csv",
      "world_cup_predictor"
    ],
    "updated_at": "2026-05-15T00:00:00Z",
    "localized_name": {
      "zh-CN": "日本"
    },
    "short_name": "JPN"
  },
  {
    "team_id": "jordan",
    "name": "Jordan",
    "aliases": [
      "Jordan",
      "约旦"
    ],
    "sources": [
      "worldcup_2026_csv",
      "world_cup_predictor"
    ],
    "updated_at": "2026-05-15T00:00:00Z",
    "localized_name": {
      "zh-CN": "约旦"
    },
    "short_name": "JOR"
  },
  {
    "team_id": "korea-republic",
    "name": "Korea Republic",
    "aliases": [
      "Korea",
      "Korea Republic",
      "South Korea",
      "韩国"
    ],
    "sources": [
      "worldcup_2026_csv",
      "world_cup_predictor"
    ],
    "updated_at": "2026-05-15T00:00:00Z",
    "localized_name": {
      "zh-CN": "韩国"
    },
    "flag_emoji": "🇰🇷",
    "fifa_rank": 25,
    "short_name": "KOR"
  },
  {
    "team_id": "mexico",
    "name": "Mexico",
    "aliases": [
      "Mexico",
      "墨西哥"
    ],
    "sources": [
      "worldcup_2026_csv",
      "world_cup_predictor"
    ],
    "updated_at": "2026-05-15T00:00:00Z",
    "localized_name": {
      "zh-CN": "墨西哥"
    },
    "short_name": "MEX"
  },
  {
    "team_id": "morocco",
    "name": "Morocco",
    "aliases": [
      "Morocco",
      "摩洛哥"
    ],
    "sources": [
      "worldcup_2026_csv",
      "world_cup_predictor"
    ],
    "updated_at": "2026-05-15T00:00:00Z",
    "localized_name": {
      "zh-CN": "摩洛哥"
    },
    "short_name": "MAR"
  },
  {
    "team_id": "netherlands",
    "name": "Netherlands",
    "aliases": [
      "Netherlands",
      "荷兰"
    ],
    "sources": [
      "worldcup_2026_csv",
      "world_cup_predictor"
    ],
    "updated_at": "2026-05-15T00:00:00Z",
    "localized_name": {
      "zh-CN": "荷兰"
    },
    "short_name": "NED"
  },
  {
    "team_id": "new-zealand",
    "name": "New Zealand",
    "aliases": [
      "New Zealand",
      "新西兰"
    ],
    "sources": [
      "worldcup_2026_csv",
      "world_cup_predictor"
    ],
    "updated_at": "2026-05-15T00:00:00Z",
    "localized_name": {
      "zh-CN": "新西兰"
    },
    "short_name": "NZL"
  },
  {
    "team_id": "norway",